{
  "schemaVersion": 1,
  "planId": "08de149e-e528-4404-9e3a-885870fdf810",
  "version": 2,
  "planRef": "plan-artifact:08de149e-e528-4404-9e3a-885870fdf810",
  "status": "brainstorming",
  "ideaId": "I009",
  "createdAt": "2026-07-07T21:27:12.540Z",
  "updatedAt": "2026-07-07T21:28:58.669Z",
  "agentDirective": {
    "schemaVersion": 1,
    "state": "brainstorming",
    "questions": [
      {
        "phase": "context",
        "fieldName": "contextProblem",
        "prompt": "In one or two sentences, what problem or opportunity does this idea address?",
        "type": "text",
        "guidance": "Restate the operator's idea in plain language before scoring. Capture the core pain or opportunity, not implementation details."
      },
      {
        "phase": "context",
        "fieldName": "contextAudience",
        "prompt": "Who benefits first if this idea succeeds?",
        "type": "text",
        "guidance": "Name the primary user or operator persona. Secondary audiences can be noted in session notes later."
      },
      {
        "phase": "value-scoring",
        "fieldName": "valueImpact",
        "prompt": "How strong is the expected impact if this idea succeeds (1=minimal, 10=transformative)?",
        "type": "score-1-10",
        "validRange": {
          "min": 1,
          "max": 10
        },
        "guidance": "Score the magnitude of outcome improvement, not confidence that it will happen."
      },
      {
        "phase": "value-scoring",
        "fieldName": "valueReach",
        "prompt": "How many users, workflows, or systems would materially benefit (1=narrow, 10=broad)?",
        "type": "score-1-10",
        "validRange": {
          "min": 1,
          "max": 10
        },
        "guidance": "Count durable beneficiaries across the workspace, not one-off convenience."
      },
      {
        "phase": "value-scoring",
        "fieldName": "valueUrgency",
        "prompt": "How time-sensitive is pursuing this idea now (1=can wait, 10=blocking now)?",
        "type": "score-1-10",
        "validRange": {
          "min": 1,
          "max": 10
        },
        "guidance": "Higher scores mean delay has clear cost or risk; lower scores mean the idea is valuable but not urgent."
      },
      {
        "phase": "value-scoring",
        "fieldName": "valueStrategicFit",
        "prompt": "How well does this idea align with current roadmap and strategic goals (1=orthogonal, 10=core)?",
        "type": "score-1-10",
        "validRange": {
          "min": 1,
          "max": 10
        },
        "guidance": "Score alignment with active phase goals and maintainer priorities, not generic importance."
      },
      {
        "phase": "risk-scoring",
        "fieldName": "riskTechnical",
        "prompt": "How high is the technical execution risk (1=well understood, 10=high unknowns)?",
        "type": "score-1-10",
        "validRange": {
          "min": 1,
          "max": 10
        },
        "guidance": "Consider architecture novelty, dependency risk, and verification difficulty."
      },
      {
        "phase": "risk-scoring",
        "fieldName": "riskOperational",
        "prompt": "How high is the operational or rollout risk (1=low blast radius, 10=wide blast radius)?",
        "type": "score-1-10",
        "validRange": {
          "min": 1,
          "max": 10
        },
        "guidance": "Include support burden, migration pain, and failure impact on active workflows."
      },
      {
        "phase": "risk-scoring",
        "fieldName": "riskUnknowns",
        "prompt": "How many unresolved unknowns remain (1=few, 10=many critical gaps)?",
        "type": "score-1-10",
        "validRange": {
          "min": 1,
          "max": 10
        },
        "guidance": "Score open questions that could invalidate the approach if left unanswered."
      },
      {
        "phase": "risk-scoring",
        "fieldName": "riskReversibility",
        "prompt": "If this idea fails or must roll back, how hard is recovery (1=easy rollback, 10=hard to unwind)?",
        "type": "score-1-10",
        "validRange": {
          "min": 1,
          "max": 10
        },
        "guidance": "Higher scores mean partial delivery or bad assumptions would be costly to reverse."
      },
      {
        "phase": "effort-scoring",
        "fieldName": "tShirtSize",
        "prompt": "What T-shirt size best fits the first shippable slice?",
        "type": "enum",
        "validValues": [
          "XS",
          "S",
          "M",
          "L",
          "XL"
        ],
        "guidance": "Estimate relative delivery size for a focused implementation slice, not the entire multi-phase vision."
      },
      {
        "phase": "effort-scoring",
        "fieldName": "complexity",
        "prompt": "How complex is the work independent of calendar time (1=straightforward, 10=deeply complex)?",
        "type": "score-1-10",
        "validRange": {
          "min": 1,
          "max": 10
        },
        "guidance": "T-shirt size and complexity are weighted independently in effortScore — a high-complexity M item intentionally scores higher than a low-complexity L item because complexity carries 60% of the effort blend."
      },
      {
        "phase": "confidence-scoring",
        "fieldName": "confidenceEvidence",
        "prompt": "How strong is the supporting evidence (1=anecdotal, 10=strong proof)?",
        "type": "score-1-10",
        "validRange": {
          "min": 1,
          "max": 10
        },
        "guidance": "Include prior art, operator feedback, telemetry, or prior experiments."
      },
      {
        "phase": "confidence-scoring",
        "fieldName": "confidenceExpertise",
        "prompt": "How available is the expertise needed to execute (1=scarce, 10=ready now)?",
        "type": "score-1-10",
        "validRange": {
          "min": 1,
          "max": 10
        },
        "guidance": "Consider team familiarity with affected modules and required review depth."
      },
      {
        "phase": "confidence-scoring",
        "fieldName": "confidenceClarity",
        "prompt": "How clear is the problem and solution boundary (1=vague, 10=crisp)?",
        "type": "score-1-10",
        "validRange": {
          "min": 1,
          "max": 10
        },
        "guidance": "Higher clarity means acceptance criteria and scope boundaries are already obvious."
      },
      {
        "phase": "unknowns",
        "fieldName": "unknownsNotes",
        "prompt": "List the top unknowns that could change the scores or scope.",
        "type": "text",
        "guidance": "Prefer concrete questions over generic risk statements. Unknowns here inform planning, not session scoring."
      },
      {
        "phase": "alternatives",
        "fieldName": "alternativesConsidered",
        "prompt": "What alternatives did you consider and why is this approach preferred?",
        "type": "text",
        "guidance": "Capture at least one credible alternative, including doing nothing, and why it was deprioritized."
      },
      {
        "phase": "session-notes",
        "fieldName": "sessionNotes",
        "prompt": "Add any session notes, assumptions, or follow-ups for the planning phase.",
        "type": "text",
        "guidance": "Keep notes concise and actionable. Do not duplicate computed scores here. After setting completedAt with update-brainstorm-session, stop and summarize the session; do not transition to planning unless the operator explicitly confirms brainstorming is finished."
      }
    ],
    "computeSteps": [
      {
        "id": "valueScore",
        "formula": "valueScore = (valueImpact × 0.30) + (valueReach × 0.25) + (valueUrgency × 0.20) + (valueStrategicFit × 0.25)",
        "description": "Weighted average of value sub-inputs."
      },
      {
        "id": "riskScore",
        "formula": "riskScore = (riskTechnical × 0.35) + (riskOperational × 0.25) + (riskUnknowns × 0.25) + (riskReversibility × 0.15)",
        "description": "Weighted average of risk sub-inputs."
      },
      {
        "id": "effortScore",
        "formula": "effortScore = (tShirtSizeScore × 0.40) + (complexity × 0.60); tShirtSizeScore map: XS=2, S=4, M=6, L=8, XL=10",
        "description": "Blend of T-shirt size and complexity. High-complexity M intentionally scores higher than low-complexity L."
      },
      {
        "id": "confidenceScore",
        "formula": "confidenceScore = (confidenceEvidence × 0.35) + (confidenceExpertise × 0.30) + (confidenceClarity × 0.35)",
        "description": "Weighted average of confidence sub-inputs."
      },
      {
        "id": "priorityScore",
        "formula": "rawPriority = ((valueScore × 0.40) + (confidenceScore × 0.20) − (riskScore × 0.25) − (effortScore × 0.15)) × 10; priorityScore = Math.round(((rawPriority + 34) / 90) × 100)",
        "description": "Priority blends upside and confidence minus risk and effort, scaled to 0–100 via rawPriority normalization."
      }
    ],
    "synthesisStep": {
      "formula": "if sessions.length===1 then synthesized=session.scores else for each score field synthesized[field]=latest[field]×0.60+mean(prior[field])×0.40",
      "description": "N=1 edge case: when sessions.length===1, synthesized=session scores; else synthesized=latest×0.60+mean(prior)×0.40."
    }
  },
  "brainstorm": {
    "sessions": [
      {
        "sessionId": "bsess-a1dc20dc-0567-4af8-b4e3-8f0dbf40d3e3",
        "startedAt": "2026-07-07T21:28:58.669Z",
        "updatedAt": "2026-07-07T21:28:58.669Z"
      }
    ],
    "activeSessionId": "bsess-a1dc20dc-0567-4af8-b4e3-8f0dbf40d3e3"
  }
}
